<?xml version="1.0" encoding="UTF-8"?>

<personas xmlns:xsi="http://www.w3.org/2001/XMLSchema-instance"
        xsi:noNamespaceSchemaLocation="ejercicio2_personas.xsd">
    
   
<persona>
    <nombre>Juan Perez</nombre>
    <nacimiento dia="3" mes="Mayo" anio="1986"/>
    <direccion>
       <call>12 de Octubre y General Foch</call>
       <ciudad>Quito</ciudad>
       <provincia>Pichincha</provincia>
       <pai>Ecuador</pai>
    </direccion>
    <genero>
      <hombre/>  
    </genero>
 </persona>
 
 <persona>
    <nombre>María López</nombre>
    <direccion>
       <call>Tamayo n12 y Francisco Salazar</call>
       <ciudad>Quito</ciudad>
       <provincia>Pichincha</provincia>
       <pai>Ecuador</pai>
    </direccion>
    <direccion>
       <call>Pichincha 605 entre Clemente Ballén y 10 de Agosto</call>
       <ciudad>Guayaquil</ciudad>
       <provincia>Guayas</provincia>
       <pai>Ecuador</pai>
    </direccion>
    <genero>        
    <mujer/>
    </genero>
 </persona>
</personas>